{
  "schemaVersion": "0.1",
  "scenarioId": "empty-workspace",
  "extendsScenarioId": null,
  "title": { "key": "scenario.empty_workspace", "fallback": "Empty workspace", "args": {} },
  "description": "A newly created Fabric workspace with no mod elements.",
  "viewportState": "empty",
  "initialMessages": [
    {
      "messageType": "query_result",
      "schemaVersion": "0.1",
      "requestId": "aaaaaaaa-aaaa-4aaa-8aaa-aaaaaaaaaaa3",
      "workspaceId": "11111111-1111-4111-8111-111111111112",
      "operation": "get_workbench",
      "status": "succeeded",
      "revision": 0,
      "data": {
        "workspace": {
          "id": "11111111-1111-4111-8111-111111111112",
          "name": "New Fabric Mod",
          "kind": "mod",
          "revision": 0,
          "dirty": false,
          "generator": {
            "id": "fabric-1.21.1",
            "loader": "fabric",
            "minecraftVersion": "1.21.1",
            "displayName": "Fabric 1.21.1",
            "state": "ready"
          },
          "lock": { "state": "write_available", "holder": null },
          "compatibility": { "mode": "native", "unknownDataPreserved": true }
        },
        "permission": {
          "profile": "workspace",
          "canRequestElevation": true,
          "protectedOperationsAlwaysConfirm": true
        },
        "connection": { "core": "connected", "network": "online", "bridge": "ready" },
        "elementCounts": { "total": 0, "valid": 0, "invalid": 0, "draft": 0, "unsupported": 0 },
        "activeTasks": [],
        "capabilities": [
          {
            "id": "mod_elements.create",
            "availability": "available",
            "reasonCode": null,
            "message": null,
            "affectedPaths": []
          }
        ],
        "recentElements": []
      },
      "diagnostics": []
    }
  ],
  "timeline": [],
  "expectedUi": {
    "announcement": "workspace_empty",
    "primaryAction": "create_mod_element",
    "focusTarget": "[data-testid=empty-primary-action]"
  }
}
